ProductName,ProductID,Brand,Price,DiscountedPrice,Category,Quantity
Eureka Super Clean Vacuum Cleaner,142,,3599,2999,Appliances,800 W
Eureka Aquasure Cartridge - 4000 Litres,141,,875,825,Water Purifiers & Accessories,1 U
Zebronics TU240C Type C Charging Cable,550,Zebronics,349,99,Zebronics,1 U
Ambrane Type-C Braided Cable (1 Metre),14,Ambrane,299,99,Appliances,1 U
Philips 1400W Gc1906/20 Steam Iron,367,Philips,1995,1599,Appliances,1 U
Duracell Chhota Power AA?Batteries,120,Duracell,95,85,Appliances,4 Unit
Ambrane Polymer Power Bank,13,Ambrane,1799,699,Appliances,1 U
Duracell Chhota Power AAA?Batteries,121,Duracell,95,85,Appliances,4 Unit
Cg Laser Ray Neo 20W Led Batten,74,,600,209,Appliances,1 U
Panasonic Multi Plug Adaptor,364,Panasonic,161,109,Appliances,1 U
Zebronics Aux Cable ASC100,542,Zebronics,169,34,Appliances,1 U
Panasonic Cherry Flexicord Flex Box,363,Panasonic,331,249,Appliances,1 Unit
Syska SDI07 Dry Iron,457,Syska,799,449,Syska,1000 W
Bajaj Dry Iron - DX4,21,Bajaj,1400,869,Appliances,1000 W
Crompton Greaves Rhino Heavy Weight Iron,91,Crompton Greaves,1400,1049,Appliances,1000 W
Bajaj MX35N Steam Iron,35,Bajaj,3800,1899,Appliances,2000 W
Crompton Greaves Dry Iron - PD Plus,89,Crompton Greaves,1030,649,Appliances,1000 W
Usha EI1602 Electric Iron,519,Usha,1290,599,Appliances,1000 W
Usha Aurora Dry Iron,517,Usha,1390,799,Appliances,1 Unit
Crompton Greaves Hill Briz Ceiling Fan 1200 mm,90,Crompton Greaves,2349,1649,Appliances,1 Unit
Crompton Greaves Super Briz Deco Ceiling Fan 1200 mm : Smoked Brown,92,Crompton Greaves,2430,1899,Appliances,Silver White
Crompton Greaves Super Briz Deco Ceiling Fan 1200 mm : Smoked Brown,92,Crompton Greaves,2430,1899,Appliances,Smoked Brown
Havells Reo Tejas Ceiling Fan 1200 mm,202,Havells,2345,1722,Appliances,1 Unit
Usha Swift Ceiling Fan 600 mm,527,Usha,2110,1799,Appliances,1 U
Usha Aerostyle Ceiling Fan 1200 mm,514,Usha,1960,1499,Appliances,1 U
Bajaj Grace DLX Bianco Ceiling Fan 1200 mm,25,Bajaj,3320,1999,Appliances,1 U
Usha Air King Deco Ceiling Fan,515,Usha,2170,1799,Appliances,1 Unit
Bajaj Grace DLX Mat Ceiling Fan 1200 mm,26,Bajaj,2110,1899,Appliances,1 U
Syska Maxair Deco Ceiling Fan Sfd 1000 - 1200 mm,454,Syska,2050,1299,Appliances,1 U
Orpat Air Flora Ceiling Fan 1200 mm,362,Orpat,1760,1399,Appliances,1 Unit
Syska Maxair Silent Operation Ceiling Fan SFP 1100 - 1200 mm,455,Syska,1899,1199,Appliances,1 U
Crompton Greaves Avancer Antidust Bakers Ceiling Fan 1200 mm,88,Crompton Greaves,4180,3599,Appliances,1 Unit
GM Air MT Electric Ceiling Fan - 1200 mm,190,GM,1799,1299,Appliances,1 U
Usha Striker Platinum GBD Ceiling Fan 1200 mm,526,Usha,2995,2499,Appliances,1 U
GM G-Breeze Deco MT Ceiling Fan - 1200 mm,191,GM,2199,1449,Appliances,1 U
Usha Mist Air Duos Pedestal Fan,524,Usha,3685,2699,Appliances,1 U
Havells Aerosupreme Deco Electric Ceiling Fan - 1200 mm,198,Havells,2680,1999,Appliances,1 U
Usha Striker Galaxy Good Bye Dust Ceiling Fan 1200 mm,525,Usha,3840,2999,Appliances,Silver Sage
Crompton IHL-201 Immersion Heater,93,Crompton Greaves,825,549,Appliances,1000 W
Crompton Instant Water Heater,95,Crompton Greaves,5600,3899,Appliances,3 L
Crompton Immersion Heater,94,Crompton,530,479,Appliances,1000 W
Usha IH2410 Immersion Heater,522,Usha,650,479,Appliances,1000 W
Borosil Rio Kettle - 1.5 Litres,53,Borosil,1290,799,Appliances,1.5 L
Crompton Greaves Ameo Mixer Grinder - 750 W,87,Crompton Greaves,4800,3499,Appliances,750 W
Kajafa Multifunctional Juicer - 400 W,241,,1550,1395,Appliances,1 Unit
Bajaj Mixer Grinder Tornado - 3 Jars,34,Bajaj,4050,2399,Appliances,550 W
Wonderchef Nutri-Blend Red With 3 Jars,539,Wonderchef,6100,2999,Appliances,400 W
Bajaj Mixer Grinder - GX4 - 500 W,33,Bajaj,3150,2449,Appliances,500 W
Bajaj GX8 Mixer Grinder - 750 W,27,Bajaj,6275,3599,Appliances,750 W
Morphy Richards Primo Classique Mixer Grinder - 750 W,320,Morphy Richards,6095,3999,Appliances,750 W
Pigeon Induction Cooktop Acer Plus,373,Pigeon,3595,1799,Pigeon,1800 W
Prestige Induction Cooktop PIC 16.0 Plus,407,Prestige,3945,2499,Appliances,1900 W
Prestige Induction Cooktop PIC 20.0,408,Prestige,3345,2149,Appliances,1 Unit
Bajaj Majesty ICX Pearl Induction Cooktop,32,Bajaj,4170,2849,Appliances,1900 W
Bajaj Majesty ICX 3 Induction Cooktop,31,Bajaj,3410,2349,Appliances,1400 W
Usha Induction Cooktop - IC3616 : 1600 W,523,Usha,3890,2399,Appliances,1 Unit
Zebronics Tulip Earphones - Black,551,Zebronics,459,149,Zebronics,1 U
Zebronics Gravity Wireless Bluetooth Neckband Earphone,545,Zebronics,1299,649,Zebronics,1 U
Zebronics Delight Bluetooth Speaker,544,Zebronics,899,499,Zebronics,3 W
Zebronics Aura Bluetooth Headphone,541,Zebronics,999,499,Zebronics,1 U
Zebronics Ms Alex Optical USB Mouse,549,Zebronics,299,149,Computer Accessories,1 U
Zebronics K20 Keyboard,547,Zebronics,399,299,Computer Accessories,1 U
Portronics Kronos Y1 Smart Watch - Grey,386,Portronics,5999,2499,Smartwatches,1 U
Butterfly Hippo Stainless Steel Gas Stove,66,Butterfly,3429,2099,Appliances,2 Burners
Basmati Rice Mogra,38,,375,289,DMart Grocery,5 kg
Basmati Rice Mogra,38,,750,549,DMart Grocery,10 kg
Rice Pulav Basmati,420,,500,398,DMart Grocery,5 kg
Basmati Rice Mini Mogra (Broken),37,,650,440,DMart Grocery,10 kg
Rice Basmati,418,,140,115,DMart Grocery,1 kg
Biryani Rice,41,,700,505,DMart Grocery,5 kg
Rice Tibar Basmati,421,,650,452,DMart Grocery,5 kg
Rice Basmati Wand : 5 kgs,419,,800,526,DMart Grocery,5 kg
Mogra Basmati Rice,319,,72,61,DMart Grocery,1 kg
Wada Kolam Rice,534,,850,615,DMart Grocery,10 kg
Wada Kolam Rice,534,,78,67,DMart Grocery,1 kg
Wada Kolam Rice,534,,500,325,DMart Grocery, 5 kg
Silky Kolam Rice,442,,460,279,DMart Grocery, 5 kg
Silky Kolam Rice,442,,69,60,DMart Grocery,1 kg
HMT Kolam Rice,204,,67,58,DMart Grocery,1 kg
HMT Kolam Rice,204,,410,263,DMart Grocery,5 kg
HMT Kolam Rice,204,,700,495,DMart Grocery,10 kg
Eco Kolam Jirasar Sorted Rice,125,,260,240,DMart Grocery, 5 kg
Eco Kolam Jirasar Sorted Rice,125,,550,425,DMart Grocery,10 kg
Premia Goda Masala,406,Premia,28,19,DMart Grocery,100 gm
Premia Akrod Whole,405,,193,148,DMart Grocery,200 gm
Shree Annapurna Jaggery Powder,437,Annapurna,100,50,DMart Grocery,1 Kg
GB Surti Kolam Sorted Rice,182,,510,315,DMart Grocery,5 kg
Disposable Paper Glass - 150 ml,107,,75,59,Tableware,Pack of 50
Disposable Paper Glass - 150 ml,107,,115,90,Tableware,Pack of 50
Disposable Paper Glass - 150 ml,107,,99,79,Tableware,Pack of 50
Disposable Paper Plates - 10 inches,109,,139,109,Tableware,Pack of 50
Disposable Paper Plates - 10 inches,109,,90,69,Tableware,Pack of 50
Disposable Paper Plates - 10 inches,109,,115,89,Tableware,Pack of 50
Disposable Wooden Spoon - 14 cm,112,,69,59,Tableware,Pack of 30
Disposable Bagasse Paper Plates - 17 cms,105,,75,59,Tableware,Pack of 15
Disposable Bagasse Paper Plates - 17 cms,105,,145,109,Tableware,Pack of 15
Disposable Bagasse Paper Plates - 17 cms,105,,145,109,Tableware,Pack of 15
Disposable Bagasse Paper Plates - 17 cms,105,,140,109,Tableware,Pack of 10
Disposable Aluminium Foil Container With Lid - 450 ml,103,,65,49,Tableware,450 ml
Disposable Aluminium Foil Container With Lid - 450 ml,103,,89,75,Tableware,750 ml
Disposable Paper Dona Bowl - 150 ml,106,,55,45,Tableware,Pack of 50
Disposable Paper Straw - 6 mm,110,,45,35,Tableware,Pack of 50
Disposable Bagasse Bowl - 180 ml,104,,75,59,Tableware,Pack of 25
Disposable Wooden Fork - 14 cm,111,,69,59,Tableware,Pack of 30
Disposable Paper Glass Riple - 250 ml,108,,140,109,Tableware,Pack of 15
Lotus Herbals Sunscreen Cream SPF 30 UVB,287,Lotus,395,245,Beauty & Cosmetics,100 gm
Lotus Herbals Kids Sun Block Cream - Sensitive Skin Formula,282,Lotus,375,285,Beauty & Cosmetics,100 gm
Lotus Herbals Sunscreen Cream SPF 20 UVB,286,Lotus,315,225,Beauty & Cosmetics,100 gm
Lakme Absolute Hydra Pro Gel Day Cream,259,Pond's,699,519,Beauty & Cosmetics,50 gm
Faces Canada Peaches N Cream Tinted Moisturizer,149,Faces Canada,599,399,Beauty & Cosmetics,35 gm
Lotus Herbals Nutranite Night Creme,283,Lotus,455,341,Beauty & Cosmetics,50 gm
Lakme Absolute Hydra Pro Overnight Gel,260,Lakme,749,599,Beauty & Cosmetics,50 gm
Faces Canada Hydro Face Moisturizer,148,Faces Canada,599,335,Beauty & Cosmetics,100 ml
Lakme Absolute Perfect Radiance Facial Foam,261,Pond's,530,344,Beauty & Cosmetics,130 ml
Lakme Youth Infinity Skin Firming Night Cream,263,Lakme,999,643,Beauty & Cosmetics,50 gm
Olay Natural Aura Instant UV Protection Glowing Cream,353,Olay,189,170,Beauty & Cosmetics,40 gm
Olay Total Effects 7-In-One Day Normal SPF 15 Cream,355,Olay,899,825,Beauty & Cosmetics,50 gm
Olay Total Effect 7 In 1 Anti Ageing Night Cream,354,Olay,899,719,Beauty & Cosmetics,50 gm
Mirabelle Papaya Fairness Facial No.1 K-Mask,315,Mirabelle,99,49,Beauty & Cosmetics,25 ml
Mirabelle Berries Fairness Facial No.1 K-Mask,311,Mirabelle,99,49,Beauty & Cosmetics,25 ml
Mirabelle Aloe Vera Fairness Facial No.1 K-Mask,310,Mirabelle,99,49,Beauty & Cosmetics,25 ml
Mirabelle Tea Tree Essential Facial Sheet Mask,317,Mirabelle,129,64,Beauty & Cosmetics,25 ml
Lotus Herbals White Glow 3 In 1 Deep Cleansing Facial Foam,288,Lotus,165,125,Beauty & Cosmetics,50 gm
Mirabelle Charcoal Premium Facial Sheet Mask,312,Mirabelle,149,74,Beauty & Cosmetics,25 ml
Mirabelle Cucumber Fairness Facial No.1 K-Mask,313,Mirabelle,99,49,Beauty & Cosmetics,25 ml
Olay Natural Aura Glowing Radiance SPF 15 Day Cream,352,Olay,399,355,Beauty & Cosmetics,50 gm
Lotus Herbals Safe Sun UV Screen Mattegel,285,Lotus,360,251,Beauty & Cosmetics,50 gm
Lotus Herbals Safe Sun Sunscreen Cream SPF 30 UVB,284,Lotus,265,205,Beauty & Cosmetics,50 gm
Neutrogena Deep Clean Facial Cleanser,330,Neutrogena,475,380,Beauty & Cosmetics,200 ml
Neutrogena Hydro Boost Water Gel,331,Neutrogena,1050,840,Beauty & Cosmetics,50 gm
Neutrogena Hydro Boost Water Gel,331,Neutrogena,450,360,Beauty & Cosmetics,15 gm
Garnier Bright Complete 30x Vitamin C Booster Serum,179,Garnier,249,195,Beauty & Cosmetics,15 ml
Garnier Bright Complete 30x Vitamin C Booster Serum,179,Garnier,449,371,Beauty & Cosmetics,30 ml
L'Oreal Revitalift 1.5% Hyaluronic Acid Serum,278,L'Oreal,499,399,Beauty & Cosmetics,15 ml
Neutrogena Ultra Sheer Dry Touch Sunblock SPF 50+,332,Neutrogena,675,540,Beauty & Cosmetics,88 ml
Garnier Bright Complete Fariness Serum Cream,180,Garnier,89,78,Beauty & Cosmetics,23 gm
L'Oreal Paris Revitalift Crystal Fresh Cream,277,L?Oreal Paris,699,508,Beauty & Cosmetics,50 ml
L'Oreal Paris Revitalift Crystal Fresh Cream,277,L?Oreal Paris,299,239,Beauty & Cosmetics,15 ml
L'Oreal Revitalift Crystal Micro Essence,279,L'Oreal,299,229,Beauty & Cosmetics,22 ml
L'Oreal Revitalift Crystal Micro Essence,279,L'Oreal,799,579,Beauty & Cosmetics,65 ml
Mirabelle Pearl+Charcoal Facial Sheet Mask,316,Mirabelle,159,79,Beauty & Cosmetics,1 U
Mirabelle Gold + Chrcol Facial Mask,314,Mirabelle,159,79,Beauty & Cosmetics,25 ml
Lakme Blush & Glow Kiwi Sheet Mask,262,Lakme,100,50,Beauty & Cosmetics,20 ml
L'Oreal Revitalift Crystal Sheet Mask,280,L'Oreal,150,120,Beauty & Cosmetics,25 gm
Garnier Men Powerwhite XL Charcoal Mask,181,Garnier,150,125,Beauty & Cosmetics,28 gm
L'Oreal Revitalift Hyaluronic Acid Serum Mask,281,L'Oreal,199,159,Beauty & Cosmetics,33 gm
Pond's Nourishing Sheet Mask,380,Pond's,75,45,Beauty & Cosmetics,1 U
Pond's Brightening Sheet Mask,379,Pond's,75,45,Beauty & Cosmetics,1 U
Plum Vitamin C Face Serum With Mandarin,378,Plum,550,440,Beauty & Cosmetics,20 ml
Lakme 9to5 Vitamin C+ Facial Serum,258,Lakme,599,449,Beauty & Cosmetics,30 ml
Plum Green Tea Renewed Clarity Night Gel,377,Plum,575,460,Beauty & Cosmetics,50 ml
I & D Black Cotton Men's T-Shirt,223,I & D,300,199,Clothing & Accessories,Size M
I & D Grey Cotton Men's T-Shirt,224,I & D,300,99,Clothing & Accessories,Size S
Macho Men's Metro Vest White RN - 80 cm (S),290,Macho,284,229,Clothing & Accessories,Size S
Macho Men's Metro Vest White RN - 80 cm (S),290,Macho,284,227,Clothing & Accessories,Size L
Macho Men's Metro Vest White RN - 80 cm (S),290,Macho,324,259,Clothing & Accessories,Size XL
No Fuss Men's Cotton Vest Sleeveless - 95 cm (XL),339,No Fuss,215,149,Clothing & Accessories,Size L
No Fuss Men's Cotton Vest Sleeveless - 95 cm (XL),339,No Fuss,215,129,Clothing & Accessories,Size XL
Dutch Harbor Men's Vest Rib Sleeveless - L (90 cm),124,Dutch Harbor,250,199,Clothing & Accessories,Size S
Dutch Harbor Men's Vest Rib Sleeveless - L (90 cm),124,Dutch Harbor,360,249,Clothing & Accessories,Size M
Dutch Harbor Men's Vest Rib Sleeveless - L (90 cm),124,Dutch Harbor,429,299,Clothing & Accessories,Size L
Macho Multicolour Brief Smart Cut - 95 cm (XL),291,Macho,266,212,Clothing & Accessories,Size S
Macho Multicolour Brief Smart Cut - 95 cm (XL),291,Macho,266,212,Clothing & Accessories,Size M
Macho Multicolour Brief Smart Cut - 95 cm (XL),291,Macho,266,212,Clothing & Accessories,Size L
Macho Multicolour Brief Smart Cut - 95 cm (XL),291,Macho,300,240,Clothing & Accessories,Size XL
Macho Multicolour Brief Smart Cut - 95 cm (XL),291,Macho,300,240,Clothing & Accessories,Size XXL
Macho Multicolour Intro Long Trunk - 95 (XL),292,Macho,196,157,Clothing & Accessories,Size M
Macho Multicolour Intro Long Trunk - 95 (XL),292,Macho,196,156,Clothing & Accessories,Size L
Macho Multicolour Intro Long Trunk - 95 (XL),292,Macho,216,173,Clothing & Accessories,Size XL
Macho Multicolour Intro Long Trunk - 95 (XL),292,Macho,216,172,Clothing & Accessories,Size XXL
Rupa Frontline Expando Men's Brief - 95 cm (XL),424,Rupa,226,181,Clothing & Accessories,Size S
Rupa Frontline Expando Men's Brief - 95 cm (XL),424,Rupa,274,219,Clothing & Accessories,Size M
Rupa Frontline Expando Men's Brief - 95 cm (XL),424,Rupa,274,219,Clothing & Accessories,Size L
Rupa Frontline Expando Men's Brief - 95 cm (XL),424,Rupa,296,236,Clothing & Accessories,Size XL
Macho Printed Mini Men's Trunk - 95 cm (XL),293,Macho,190,152,Clothing & Accessories,Size M
Macho Printed Mini Men's Trunk - 95 cm (XL),293,Macho,190,152,Clothing & Accessories,Size L
Macho Printed Mini Men's Trunk - 95 cm (XL),293,Macho,210,168,Clothing & Accessories,Size XL
Macho Printed Mini Men's Trunk - 95 cm (XL),293,Macho,210,168,Clothing & Accessories,Size XXL
Rupa Frontline DRAW Men's Trunk - 95cm (XL),423,Rupa,202,161,Clothing & Accessories,Size M
Rupa Frontline DRAW Men's Trunk - 95cm (XL),423,Rupa,202,161,Clothing & Accessories,Size L
No Fuss Men's 100% Cotton Boxers - B01 (XL),338,No Fuss,375,325,Clothing & Accessories,Size M
No Fuss Men's 100% Cotton Boxers - B01 (XL),338,No Fuss,375,325,Clothing & Accessories,Size L
No Fuss Men's 100% Cotton Boxers - B01 (XL),338,No Fuss,499,399,Clothing & Accessories,Size XL
No Fuss Men's Shorts Combo D02,342,No Fuss,350,279,Clothing & Accessories,Size M
No Fuss Men's Shorts Combo D02,342,No Fuss,350,279,Clothing & Accessories,Size L
No Fuss Men's Shorts Combo D02,342,No Fuss,350,279,Clothing & Accessories,Size XL
No Fuss Men'S Shorts Combo With Side Pockets - D01,343,No Fuss,350,279,Clothing & Accessories,Size S
No Fuss Men'S Shorts Combo With Side Pockets - D01,343,No Fuss,350,279,Clothing & Accessories,Size M
No Fuss Men'S Shorts Combo With Side Pockets - D01,343,No Fuss,350,279,Clothing & Accessories,Size L
No Fuss Men'S Shorts Combo With Side Pockets - D01,343,No Fuss,429,299,Clothing & Accessories,Size XL
No Fuss Gent's White,337,No Fuss,169,129,Clothing & Accessories,Pack of 6
No Fuss Men's Sneaker Socks,344,No Fuss,169,125,Clothing & Accessories,Pack of 3
Dutch Harbor Gent's Hanky - White,123,Dutch Harbor,249,199,Clothing & Accessories,Pack of 6
No Fuss Men's Sports Ankle Socks,345,No Fuss,225,165,Clothing & Accessories,Pack of 3
Dutch Harbor Gent's Hanky - Multicolour,122,Dutch Harbor,275,225,Clothing & Accessories,Pack of 6
No Fuss Gent's Hanky - Multicolour,334,No Fuss,199,149,Clothing & Accessories,Pack of 6
No Fuss Gent's Hanky - White,335,No Fuss,169,129,Clothing & Accessories,Pack of 6
No Fuss Men's Loafer Socks,340,No Fuss,169,129,Clothing & Accessories,Pack of 3
No Fuss Gent's Hanky - White/Blue,336,No Fuss,169,129,Clothing & Accessories,Pack of 6
No Fuss Men's Loafer Socks - D2,341,No Fuss,169,64,Clothing & Accessories,Pack of 3
FNF Crossline Men's Hanky - Multicolour,176,,180,119,Clothing & Accessories,3 Pcs
Feather Soft Black Ankle Length Legging - 1 Unit,157,Feather Soft,499,299,Clothing & Accessories,Size M
Feather Soft Black Ankle Length Legging - 1 Unit,157,Feather Soft,499,299,Clothing & Accessories,Size L
Feather Soft Black Ankle Length Legging - 1 Unit,157,Feather Soft,499,299,Clothing & Accessories,Size XL
Feather Soft Black Ankle Length Legging - 1 Unit,157,Feather Soft,499,299,Clothing & Accessories,Size XXL
Feather Soft Black Ankle Length Legging - 1 Unit,157,Feather Soft,499,299,Clothing & Accessories,Size XXXL
Feather Soft White Ankle Length Legging - 1 Unit,161,Feather Soft,499,299,Clothing & Accessories,Size M
Feather Soft White Ankle Length Legging - 1 Unit,161,Feather Soft,499,299,Clothing & Accessories,Size L
Feather Soft White Ankle Length Legging - 1 Unit,161,Feather Soft,499,299,Clothing & Accessories,Size XL
Feather Soft White Ankle Length Legging - 1 Unit,161,Feather Soft,499,299,Clothing & Accessories,Size XXL
Feather Soft White Ankle Length Legging - 1 Unit,161,Feather Soft,499,299,Clothing & Accessories,Size XXXL
Feather Soft Navy Blue Ankle Length Legging - 1 Unit,158,Feather Soft,499,149,Clothing & Accessories,Size M
Feather Soft Navy Blue Ankle Length Legging - 1 Unit,158,Feather Soft,499,149,Clothing & Accessories,Size L
Feather Soft Navy Blue Ankle Length Legging - 1 Unit,158,Feather Soft,499,299,Clothing & Accessories,Size XL
Feather Soft Navy Blue Ankle Length Legging - 1 Unit,158,Feather Soft,499,299,Clothing & Accessories,Size XXL
Feather Soft Red Ankle Length Legging - 1 Unit,159,Feather Soft,499,149,Clothing & Accessories,Size M
Feather Soft Red Ankle Length Legging - 1 Unit,159,Feather Soft,499,149,Clothing & Accessories,Size L
Feather Soft Red Ankle Length Legging - 1 Unit,159,Feather Soft,499,299,Clothing & Accessories,Size XL
Feather Soft Red Ankle Length Legging - 1 Unit,159,Feather Soft,499,149,Clothing & Accessories,Size XXL
Feather Soft Skin Color Ankle Length Legging - 1 Unit,160,Feather Soft,499,149,Clothing & Accessories,Size M
Feather Soft Skin Color Ankle Length Legging - 1 Unit,160,Feather Soft,499,149,Clothing & Accessories,Size L
Feather Soft Skin Color Ankle Length Legging - 1 Unit,160,Feather Soft,499,149,Clothing & Accessories,Size XL
Feather Soft Skin Color Ankle Length Legging - 1 Unit,160,Feather Soft,499,149,Clothing & Accessories,Size XXL
Feather Soft Skin Color Ankle Length Legging - 1 Unit,160,Feather Soft,499,149,Clothing & Accessories,Size XXXL
Clio Ladies T-Shirt & Pyjama Nightwear Set (A1),77,Clio,475,399,Clothing & Accessories,Size S
Clio Ladies T-Shirt & Pyjama Nightwear Set (A1),77,Clio,475,399,Clothing & Accessories,Size M
Clio Ladies T-Shirt & Pyjama Nightwear Set (A1),77,Clio,475,399,Clothing & Accessories,Size L
Clio Ladies T-Shirt & Pyjama Nightwear Set (A5),80,Clio,475,399,Clothing & Accessories,Size M
Clio Ladies T-Shirt & Pyjama Nightwear Set (A5),80,Clio,475,399,Clothing & Accessories,Size S
Clio Ladies T-Shirt & Pyjama Nightwear Set (A5),80,Clio,475,399,Clothing & Accessories,Size L
Clio Ladies T-Shirt & Pyjama Nightwear Set (A4),79,Clio,475,399,Clothing & Accessories,Size L
Clio Ladies T-Shirt & Pyjama Nightwear Set (A2),78,Clio,475,399,Clothing & Accessories,Size L
Clio Ladies T-Shirt & Pyjama Nightwear Set (A6),81,Clio,475,399,Clothing & Accessories,Size M
Clio Ladies T-Shirt & Pyjama Nightwear Set (A6),81,Clio,475,399,Clothing & Accessories,Size L
Clio Ladies T-Shirt & Pyjama Nightwear Set (A6),81,Clio,475,399,Clothing & Accessories,Size S
Clio?Ladies T-Shirt & Pyjama Nightwear Set (B2),83,Clio,599,249,Clothing & Accessories,Size S
Clio?Ladies T-Shirt & Pyjama Nightwear Set (B3),84,Clio,599,249,Clothing & Accessories,Size S
Clio?Ladies T-Shirt & Pyjama Nightwear Set (B3),84,Clio,599,249,Clothing & Accessories,Size M
Clio?Ladies T-Shirt & Pyjama Nightwear Set (B1),82,Clio,599,249,Clothing & Accessories,Size S
Clio?Ladies T-Shirt & Pyjama Nightwear Set (B4),85,Clio,599,249,Clothing & Accessories,Size S
In Shape Ladies Inner Elastic Hipster Panties - C,229,In Shape,450,299,Clothing & Accessories,XL (95 cm)
In Shape Ladies Inner Elastic Hipster Panties - C,229,In Shape,450,299,Clothing & Accessories,M (85 cm)
In Shape Ladies Inner Elastic Hipster Panties - C,229,In Shape,500,325,Clothing & Accessories,XXXL (105 cm)
In Shape Ladies Inner Elastic Hipster Panties - B,228,In Shape,500,325,Clothing & Accessories,XXXL (105 cm)
In Shape Ladies Inner Elastic Hipster Panties - B,228,In Shape,450,299,Clothing & Accessories,XL (95 cm)
In Shape Ladies Inner Elastic Hipster Panties - B,228,In Shape,475,299,Clothing & Accessories,XXL (100 cm)
Krish Plastic Round Planter Pot - 112,253,,80,69,Plant Container,1 U
Krish Plastic Round Planter Pot - 110,252,,60,49,Plant Container,1 Unit
Pot Planter Saucer Base Plate - 16.5 cm,403,,17,15,Plant Container,1 Unit
Hanging Hook Pot Planter - Assorted,195,,130,79,Plant Container,1 Unit
Hanging Double Hook Pot Planter - Assorted,194,,120,99,Plant Container,1 Unit
Krish Plastic Round Planter Pot - 108,251,,50,39,Plant Container,1 Unit
Pot Planter Saucer Base Plate - 13 cm,402,,17,15,Plant Container,1 Unit
Pot Planter Saucer Base Plate - 10 cm,401,,12,10,Plant Container,1 Unit
Krish Hook Pot Planter - Purple,245,,130,79,Plant Container,1 U
Krish Hook Pot Planter - Yellow,246,,130,79,Plant Container,1 U
Krish Square Planter - 10 - Red,256,,150,99,Plant Container,1 U
Planter Honeycomb With Black Chain - Purple,375,,80,69,Plant Container,1 U
Krish Planter 110 - Orange,248,,150,89,Plant Container,1 U
Krish Planter 110 - Red,250,,150,89,Plant Container,1 U
Krish Square Planter - 10 - Blue,254,,150,99,Plant Container,1 U
Planter Honeycomb With Black Chain - Blue,374,,80,69,Plant Container,1 U
Krish Hook Pot Planter - Blue,244,,130,79,Plant Container,1 U
Krish Square Planter - 10 - Orange,255,,150,99,Plant Container,1 U
Krish Planter 110 - Purple,249,,150,89,Plant Container,1 U
Krish Planter 110 - Blue,247,,150,89,Plant Container,1 U
Metal Planter Stand - 20 cms - Black,299,,200,99,Plant Container,1 U
Metal Planter Stand - 20 cms - Golden,301,,200,99,Plant Container,1 U
Metal Planter Stand - 20 cms - Copper,300,,200,99,Plant Container,1 U
Zeel MS201 Men's Raincoat - Blue,570,Zeel,499,449,Raincoat,Size XL
Zeel MS201 Men's Raincoat - Blue,570,Zeel,499,449,Raincoat,Size XXL
Zeel MS201 Men's Raincoat - Purple,572,Zeel,499,449,Raincoat,Size XL
Zeel MS201 Men's Raincoat - Purple,572,Zeel,499,449,Raincoat,Size XXL
Zeel MS201 Men's Raincoat - Light Green,571,Zeel,499,449,Raincoat,Size XL
Zeel MS201 Men's Raincoat - Light Green,571,Zeel,499,449,Raincoat,Size XXL
Zeel MS301 Men's Raincoat - Black,573,Zeel,499,449,Raincoat,Size L
Zeel MS301 Men's Raincoat - Black,573,Zeel,499,449,Raincoat,Size XL
Zeel MS301 Men's Raincoat - Black,573,Zeel,499,449,Raincoat,Size XXL
Zeel MS301 Men's Raincoat - Navy Blue,575,Zeel,499,449,Raincoat,Size L
Zeel MS301 Men's Raincoat - Navy Blue,575,Zeel,499,449,Raincoat,Size XL
Zeel MS301 Men's Raincoat - Navy Blue,575,Zeel,499,449,Raincoat,Size XXL
Zeel MS301 Men's Raincoat - Grey,574,Zeel,499,449,Raincoat,Size L
Zeel MS301 Men's Raincoat - Grey,574,Zeel,499,449,Raincoat,Size XL
Zeel MS301 Men's Raincoat - Grey,574,Zeel,499,449,Raincoat,Size XXL
Zeel MR203 Men's Raincoat - Black,568,Zeel,1450,1199,Raincoat,Size XL
Zeel MR203 Men's Raincoat - Black,568,Zeel,1450,1199,Raincoat,Size XXL
Zeel MR203 Men's Raincoat - Navy Blue,569,Zeel,1450,1199,Raincoat,Size XXL
Zeel MR161 Men's Raincoat - Black,563,Zeel,1500,1299,Raincoat,Size XL
Zeel MR161 Men's Raincoat - Black,563,Zeel,1500,1299,Raincoat,Size XXL
Zeel MR161 Men's Raincoat - Navy Blue,564,Zeel,1500,1299,Raincoat,Size XL
Zeel MR161 Men's Raincoat - Navy Blue,564,Zeel,1500,1299,Raincoat,Size XXL
Zeel MR168 Men's Raincoat - Black,565,Zeel,1700,1499,Raincoat,Size XL
Zeel MR184 Men's Raincoat - Black,566,Zeel,1700,1499,Raincoat,Size XL
Zeel MR184 Men's Raincoat - Black,566,Zeel,1700,1499,Raincoat,Size XXL
Zeel MR184 Men's Raincoat - Navy Blue,567,Zeel,1700,1499,Raincoat,Size XL
Zeel MR184 Men's Raincoat - Navy Blue,567,Zeel,1700,1499,Raincoat,Size XXL
Zeel LP306 Women's Raincoat - Pink,562,Zeel,550,479,Raincoat,Size L
Zeel LP306 Women's Raincoat - Pink,562,Zeel,550,479,Raincoat,Size XL
Zeel LP306 Women's Raincoat - Orange,561,Zeel,550,479,Raincoat,Size L
Zeel LP306 Women's Raincoat - Orange,561,Zeel,550,479,Raincoat,Size XL
Zeel MT212 Men's Raincoat - Navy Blue : Size XXL,576,Zeel,1199,1049,Raincoat,Size XL
Zeel MT212 Men's Raincoat - Navy Blue : Size XXL,576,Zeel,1199,1049,Raincoat,
MP Sihore Wheat,321,,350,260,DMart Grocery,5 kg
MP Sihore Wheat,321,,570,370,DMart Grocery,10 kg
Maida,295,,26,22,DMart Grocery,500 gm
Maida,295,,49,39,DMart Grocery,1 kg
Jawar (Sorghum) Solapur,239,,75,60,DMart Grocery,1 kg
Bhagar,39,,93,76,DMart Grocery,500 gm
Idli Rava,226,,26,22,DMart Grocery,500 gm
Idli Rava,226,,51,45,DMart Grocery,1 kg
No Fuss Women's Hanky - White,347,No Fuss,99,79,Clothing & Accessories,Pack of 6
No Fuss Women's Hanky - Multicolour,346,No Fuss,99,79,Clothing & Accessories,Pack of 6
"truke Buds Vibe with 35dB ANC, 4Mic ENC, 13mm Speaker, ...",509,,"1,599",,Earphones,
Mivi DuoPods M30 earbuds with 42 hours of playtime | Ma...,318,,899,,Earphones,
Boult Audio Bassbuds X1 Wired Headset,54,,349,,Earphones,
boAt Bassheads 103 Black Wired Headset,46,,499,,Earphones,
Ubon GP-321 Champ Earphone Wired Headset,512,,172,,Earphones,
boAt BassHeads 100 Wired Headset,45,,399,,Earphones,
"Boult Audio Loop2 with 10mm Drivers, BoomX Rich Bass, I...",57,,349,,Earphones,
"Boult Audio Curve with BoomX Rich Bass, Flexi-band, Mag...",55,,899,,Earphones,
boAt Bassheads 103 Blue Wired Headset,47,,499,,Earphones,
boAt Bassheads 242 Wired Headset,51,,599,,Earphones,
Aroma NB119B Badshah - 40 Hours Playtime Bluetooth Neck...,19,,381,,Earphones,
"Boult Audio Gearpods with 32H Playtime, Fast Charging, ...",56,,999,,Earphones,
